{
  "run_id": "agentic-20260220-015140",
  "created_at": "2026-02-20T01:51:44.385327+00:00",
  "task_pack_id": "thomas-agentic-smoke-v1",
  "task_pack_version": 1,
  "competitors": [
    "thomas_os"
  ],
  "summary": {
    "weights": {
      "success_rate": 0.6,
      "speed": 0.2,
      "follow_up": 0.0,
      "quality": 0.2
    },
    "quality_scale": {
      "min": 1,
      "max": 5
    },
    "competitors": {
      "thomas_os": {
        "tasks_total": 1,
        "tasks_completed": 1,
        "missing_task_count": 0,
        "success_count": 0,
        "success_rate": 0.0,
        "evidence_count": 1,
        "evidence_coverage": 1.0,
        "avg_elapsed_seconds": 3.422,
        "avg_follow_up_prompts": 0.0,
        "avg_quality_score": 1.0,
        "quality_score_norm": 0.0,
        "speed_norm": 1.0,
        "follow_up_norm": 1.0,
        "weighted_score": 20.0,
        "credibility_weighted_score": 20.0
      }
    },
    "ranking": [
      {
        "competitor": "thomas_os",
        "weighted_score": 20.0,
        "rank": 1
      }
    ],
    "credibility_ranking": [
      {
        "competitor": "thomas_os",
        "credibility_weighted_score": 20.0,
        "rank": 1
      }
    ],
    "task_winners": [
      {
        "task_id": "artifact_probe_write",
        "winners": [
          "thomas_os"
        ]
      }
    ]
  }
}
